{
  "file": "timeline.json",
  "schema_version": "0.1.0",
  "updated": "2026-10-21",
  "claim_model": {
    "value": "...",
    "units": "...",
    "precision": "...",
    "inference_score": 0,
    "source_ids": [
      "..."
    ]
  },
  "sources": [
    {
      "source_id": "TCS-WWKC-WEB-0001",
      "title": "The Cruel Song – Who Was Karmein Chan?",
      "url": "https://thecruelsong.com/",
      "locators": [
        "#timeline"
      ]
    }
  ],
  "timeline": [
    {
      "id": "KCEVT0001",
      "record_type": "timeline_event",
      "event_type": {
        "value": "personal_milestone",
        "units": "event_category",
        "precision": "controlled_label",
        "inference_score": 0,
        "source_ids": [
          "TCS-WWKC-WEB-0001"
        ]
      },
      "title": {
        "value": "Karmein Chan’s birth",
        "units": "event_title",
        "precision": "normalized_from_timeline_entry",
        "inference_score": 0,
        "source_ids": [
          "TCS-WWKC-WEB-0001"
        ]
      },
      "date": {
        "value": "1977-11-05",
        "units": "iso8601_date",
        "precision": "day",
        "inference_score": 0,
        "source_ids": [
          "TCS-WWKC-WEB-0001"
        ]
      },
      "summary": {
        "value": "Karmein Chan’s birth",
        "units": "event_summary",
        "precision": "paraphrased_from_timeline_entry",
        "inference_score": 0,
        "source_ids": [
          "TCS-WWKC-WEB-0001"
        ]
      },
      "source_locator": {
        "value": "#timeline",
        "units": "html_anchor",
        "precision": "section_anchor",
        "inference_score": 0,
        "source_ids": [
          "TCS-WWKC-WEB-0001"
        ]
      },
      "related_person_ids": [
        "TCS-WWKC-PPL-0001"
      ],
      "related_place_ids": [],
      "review_flags": []
    },
    {
      "id": "KCEVT0002",
      "record_type": "timeline_event",
      "event_type": {
        "value": "family_business",
        "units": "event_category",
        "precision": "controlled_label",
        "inference_score": 0,
        "source_ids": [
          "TCS-WWKC-WEB-0001"
        ]
      },
      "title": {
        "value": "Hong Kong style restaurant named Mings opens at Bulleen Plaza",
        "units": "event_title",
        "precision": "normalized_from_timeline_entry",
        "inference_score": 0,
        "source_ids": [
          "TCS-WWKC-WEB-0001",
          "KCSRC00035"
        ]
      },
      "date": {
        "value": "1978",
        "units": "iso8601_year",
        "precision": "year",
        "inference_score": 0,
        "source_ids": [
          "TCS-WWKC-WEB-0001",
          "KCSRC00035"
        ]
      },
      "summary": {
        "value": "A Hong Kong style restaurant named Mings opens at the Bulleen Plaza shopping centre (the restaurant opened in 1978; the shopping centre itself opened in 1974, see KCPLACE0005).",
        "units": "event_summary",
        "precision": "paraphrased_from_timeline_entry",
        "inference_score": 0,
        "source_ids": [
          "TCS-WWKC-WEB-0001",
          "KCSRC00035"
        ]
      },
      "source_locator": {
        "value": "#timeline",
        "units": "html_anchor",
        "precision": "section_anchor",
        "inference_score": 0,
        "source_ids": [
          "TCS-WWKC-WEB-0001"
        ]
      },
      "related_person_ids": [
        "TCS-WWKC-PPL-0002",
        "TCS-WWKC-PPL-0003"
      ],
      "related_place_ids": [
        "KCPLACE0005"
      ],
      "review_flags": [
        "1978 is the restaurant's opening year, not the shopping centre's (1974: KCSRC00068, KCSRC00065)."
      ]
    },
    {
      "id": "KCEVT0003",
      "record_type": "timeline_event",
      "event_type": {
        "value": "personal_milestone",
        "units": "event_category",
        "precision": "controlled_label",
        "inference_score": 0,
        "source_ids": [
          "TCS-WWKC-WEB-0001"
        ]
      },
      "title": {
        "value": "Karly Chan’s birth",
        "units": "event_title",
        "precision": "normalized_from_timeline_entry",
        "inference_score": 0,
        "source_ids": [
          "TCS-WWKC-WEB-0001",
          "KCSRC00006"
        ]
      },
      "date": {
        "value": "1981-06",
        "units": "iso8601_month",
        "precision": "month",
        "inference_score": 0,
        "source_ids": [
          "TCS-WWKC-WEB-0001",
          "KCSRC00006"
        ]
      },
      "summary": {
        "value": "Karly Chan’s birth",
        "units": "event_summary",
        "precision": "paraphrased_from_timeline_entry",
        "inference_score": 0,
        "source_ids": [
          "TCS-WWKC-WEB-0001",
          "KCSRC00006"
        ]
      },
      "source_locator": {
        "value": "#timeline",
        "units": "html_anchor",
        "precision": "section_anchor",
        "inference_score": 0,
        "source_ids": [
          "TCS-WWKC-WEB-0001"
        ]
      },
      "related_person_ids": [
        "TCS-WWKC-PPL-0004"
      ],
      "related_place_ids": [],
      "review_flags": []
    },
    {
      "id": "KCEVT0004",
      "record_type": "timeline_event",
      "event_type": {
        "value": "personal_milestone",
        "units": "event_category",
        "precision": "controlled_label",
        "inference_score": 0,
        "source_ids": [
          "TCS-WWKC-WEB-0001"
        ]
      },
      "title": {
        "value": "Karen Chan’s birth",
        "units": "event_title",
        "precision": "normalized_from_timeline_entry",
        "inference_score": 0,
        "source_ids": [
          "TCS-WWKC-WEB-0001",
          "KCSRC00043"
        ]
      },
      "date": {
        "value": "1983-05-31",
        "units": "iso8601_date",
        "precision": "day",
        "inference_score": 0,
        "source_ids": [
          "TCS-WWKC-WEB-0001",
          "KCSRC00043"
        ]
      },
      "summary": {
        "value": "Karen Chan’s birth",
        "units": "event_summary",
        "precision": "paraphrased_from_timeline_entry",
        "inference_score": 0,
        "source_ids": [
          "TCS-WWKC-WEB-0001",
          "KCSRC00043"
        ]
      },
      "source_locator": {
        "value": "#timeline",
        "units": "html_anchor",
        "precision": "section_anchor",
        "inference_score": 0,
        "source_ids": [
          "TCS-WWKC-WEB-0001"
        ]
      },
      "related_person_ids": [
        "TCS-WWKC-PPL-0005"
      ],
      "related_place_ids": [],
      "review_flags": []
    },
    {
      "id": "KCEVT0005",
      "record_type": "timeline_event",
      "event_type": {
        "value": "medical_history",
        "units": "event_category",
        "precision": "controlled_label",
        "inference_score": 0,
        "source_ids": [
          "TCS-WWKC-WEB-0001"
        ]
      },
      "title": {
        "value": "Karmein Chan has glandular fever",
        "units": "event_title",
        "precision": "normalized_from_timeline_entry",
        "inference_score": 0,
        "source_ids": [
          "TCS-WWKC-WEB-0001",
          "KCSRC00018"
        ]
      },
      "date": {
        "value": "1989-09",
        "units": "iso8601_month",
        "precision": "month",
        "inference_score": 0,
        "source_ids": [
          "TCS-WWKC-WEB-0001",
          "KCSRC00018"
        ]
      },
      "summary": {
        "value": "Karmein Chan has glandular fever, also known as infectious mononucleosis, and receives treatment at the Royal Children’s Hospital of Melbourne.",
        "units": "event_summary",
        "precision": "paraphrased_from_timeline_entry",
        "inference_score": 0,
        "source_ids": [
          "TCS-WWKC-WEB-0001",
          "KCSRC00018"
        ]
      },
      "source_locator": {
        "value": "#timeline",
        "units": "html_anchor",
        "precision": "section_anchor",
        "inference_score": 0,
        "source_ids": [
          "TCS-WWKC-WEB-0001"
        ]
      },
      "related_person_ids": [
        "TCS-WWKC-PPL-0001"
      ],
      "related_place_ids": [
        "KCPLACE0009"
      ],
      "review_flags": []
    },
    {
      "id": "KCEVT0006",
      "record_type": "timeline_event",
      "event_type": {
        "value": "personal_milestone",
        "units": "event_category",
        "precision": "controlled_label",
        "inference_score": 0,
        "source_ids": [
          "TCS-WWKC-WEB-0001"
        ]
      },
      "title": {
        "value": "Karmein Chan’s 13th birthday",
        "units": "event_title",
        "precision": "normalized_from_timeline_entry",
        "inference_score": 0,
        "source_ids": [
          "TCS-WWKC-WEB-0001"
        ]
      },
      "date": {
        "value": "1990-11-05",
        "units": "iso8601_date",
        "precision": "day",
        "inference_score": 0,
        "source_ids": [
          "TCS-WWKC-WEB-0001"
        ]
      },
      "summary": {
        "value": "Karmein Chan’s 13th birthday",
        "units": "event_summary",
        "precision": "paraphrased_from_timeline_entry",
        "inference_score": 0,
        "source_ids": [
          "TCS-WWKC-WEB-0001"
        ]
      },
      "source_locator": {
        "value": "#timeline",
        "units": "html_anchor",
        "precision": "section_anchor",
        "inference_score": 0,
        "source_ids": [
          "TCS-WWKC-WEB-0001"
        ]
      },
      "related_person_ids": [
        "TCS-WWKC-PPL-0001"
      ],
      "related_place_ids": [],
      "review_flags": []
    },
    {
      "id": "KCEVT0007",
      "record_type": "timeline_event",
      "event_type": {
        "value": "public_context",
        "units": "event_category",
        "precision": "controlled_label",
        "inference_score": 0,
        "source_ids": [
          "TCS-WWKC-WEB-0001"
        ]
      },
      "title": {
        "value": "Melbourne Cup takes place at Flemington Racecourse",